TypeScript,Assess, Languages & Frameworks, day5
Capturing client-side JavaScript errors, Adopt, Techniques, day5
Storm, Assess, Platforms, day5
Akka, Assess, Platforms, day5
Backend-as-a-service, Assess, Platforms, day4
Reactive Language Extensions, Trial, Languages & Frameworks, day4
Web Components standard, Assess, Platforms, day4
Spdy, Assess, Platforms, day4
HTML5 storage instead of cookies, Trial, Techniques, day4
Go Lang,Trial, Languages & Frameworks, day4
Velocity as Productivity, Hold, Techniques, day3
CoffeeScript, Trial, Languages & Frameworks, day3
Grunt.js,Trial, Tools, day3
D3, Adopt, Tools, day3
Clojure, Adopt, Languages & Frameworks, day3
Icon fonts, Trial, Tools, day3
Windows infrastructure automation, Adopt, Techniques, day2
Dependency management for javascript, Adopt, Tools, day2
Dropwizard,Adopt, Languages & Frameworks, day2
Sinatra,Adopt, Languages & Frameworks, day2
OWIN, Assess, Languages & Frameworks, day2
Heavyweight test tools, Hold, Tools, day1
Development environments in the cloud, Assess, Techniques,day1
Focus on mean time to recovery, Assess, Techniques, day1
Elastic Search, Adopt, Platforms, day1
